{
  "adjacency": {
    "forward": {
      "giga_tech_amb_living_metal_infusion": {
        "prerequisite": [
          0,
          1
        ]
      },
      "giga_tech_arkship_neutronium_harvester": {
        "potential-gate": [
          2
        ],
        "prerequisite": [
          3
        ]
      },
      "giga_tech_asteroid_artillery": {
        "alternative": [
          4,
          5
        ]
      },
      "giga_tech_asteroid_artillery_health_upgrade": {
        "prerequisite": [
          6
        ]
      },
      "giga_tech_blokkat_engineering_repeatable": {
        "prerequisite": [
          7
        ]
      },
      "giga_tech_disco_moon": {
        "prerequisite": [
          8
        ]
      },
      "giga_tech_equatorial_shipyard": {
        "prerequisite": [
          9
        ]
      },
      "giga_tech_interstellar_habitat": {
        "prerequisite": [
          10,
          11,
          12
        ]
      },
      "giga_tech_maginot_firepower_1": {
        "prerequisite": [
          13
        ]
      },
      "giga_tech_maginot_world": {
        "prerequisite": [
          14,
          15
        ]
      },
      "giga_tech_orbital_arcologies": {
        "prerequisite": [
          16
        ]
      },
      "giga_tech_penrose_sphere_1": {
        "prerequisite": [
          17,
          18
        ]
      },
      "giga_tech_planetary_drive_yard": {
        "prerequisite": [
          19
        ]
      },
      "giga_tech_psychic_hypersiphon": {
        "prerequisite": [
          20
        ]
      },
      "giga_tech_repeatable_alderson_cap": {
        "prerequisite": [
          21
        ]
      },
      "giga_tech_repeatable_maginot_cap": {
        "prerequisite": [
          22
        ]
      },
      "giga_tech_repeatable_reduced_mega_building_time": {
        "prerequisite": [
          23
        ]
      },
      "giga_tech_ringworld_buildings": {
        "prerequisite": [
          24
        ]
      },
      "giga_tech_substellar_compressor": {
        "prerequisite": [
          25,
          26
        ]
      },
      "giga_tech_war_moon_1": {
        "prerequisite": [
          27,
          28
        ]
      },
      "giga_tech_yggdrasil_orchid": {
        "alternative": [
          29,
          30
        ],
        "prerequisite": [
          31
        ]
      },
      "tech_arkship_tier_3": {
        "alternative": [
          32,
          33
        ]
      },
      "tech_dyson_sphere": {
        "prerequisite": [
          34
        ]
      },
      "tech_ehof_phase_03": {
        "alternative": [
          35
        ]
      },
      "tech_frameworld_defensive_station_5": {
        "potential-gate": [
          36
        ]
      },
      "tech_frameworld_repeatable_outpost_output": {
        "prerequisite": [
          37
        ]
      },
      "tech_gateway_construction": {
        "prerequisite": [
          38
        ]
      },
      "tech_habitat_1": {
        "prerequisite": [
          39
        ]
      },
      "tech_habitat_2": {
        "prerequisite": [
          40
        ]
      },
      "tech_housing_2": {
        "prerequisite": [
          41
        ]
      },
      "tech_interstellar_assembly": {
        "prerequisite": [
          42
        ]
      },
      "tech_matter_decompressor": {
        "prerequisite": [
          43
        ]
      },
      "tech_mega_art": {
        "prerequisite": [
          44
        ]
      },
      "tech_mega_engineering": {
        "alternative": [
          45,
          46,
          47,
          48
        ],
        "prerequisite": [
          49
        ]
      },
      "tech_mega_shipyard": {
        "prerequisite": [
          50
        ]
      },
      "tech_quantum_catapult": {
        "potential-gate": [
          51
        ]
      },
      "tech_ring_world": {
        "prerequisite": [
          52
        ]
      },
      "tech_science_nexus": {
        "prerequisite": [
          53
        ]
      },
      "tech_sentry_array": {
        "prerequisite": [
          54
        ]
      },
      "tech_sm_megastructure": {
        "prerequisite": [
          55
        ]
      },
      "tech_strategic_coordination": {
        "prerequisite": [
          56
        ]
      }
    },
    "reverse": {
      "giga_tech_alderson_disk": {
        "prerequisite": [
          21
        ]
      },
      "giga_tech_amb_supertensiles": {
        "prerequisite": [
          0
        ]
      },
      "giga_tech_asteroid_artillery": {
        "prerequisite": [
          14,
          27
        ]
      },
      "giga_tech_blokkat_armor_study": {
        "prerequisite": [
          7
        ]
      },
      "giga_tech_maginot_world": {
        "potential-gate": [
          36
        ],
        "prerequisite": [
          13,
          22
        ]
      },
      "tech_arkship_tier_3": {
        "alternative": [
          45
        ]
      },
      "tech_battleships": {
        "alternative": [
          4,
          29,
          32,
          46
        ]
      },
      "tech_gateway_construction": {
        "prerequisite": [
          10
        ]
      },
      "tech_habitat_1": {
        "prerequisite": [
          11,
          40
        ]
      },
      "tech_housing_1": {
        "prerequisite": [
          41
        ]
      },
      "tech_mega_engineering": {
        "alternative": [
          35
        ],
        "potential-gate": [
          2,
          51
        ],
        "prerequisite": [
          3,
          6,
          8,
          9,
          12,
          15,
          16,
          17,
          19,
          20,
          23,
          24,
          25,
          28,
          31,
          34,
          37,
          38,
          42,
          43,
          44,
          50,
          52,
          53,
          54,
          55,
          56
        ]
      },
      "tech_mine_living_metal": {
        "prerequisite": [
          1
        ]
      },
      "tech_starbase_3": {
        "prerequisite": [
          39
        ]
      },
      "tech_starbase_5": {
        "alternative": [
          47
        ]
      },
      "tech_stingers": {
        "alternative": [
          5,
          30,
          33,
          48
        ]
      },
      "tech_zero_point_power": {
        "prerequisite": [
          18,
          26,
          49
        ]
      }
    }
  },
  "categories": [
    "archaeostudies",
    "biology",
    "blokkats",
    "computing",
    "field_manipulation",
    "industry",
    "materials",
    "military_theory",
    "new_worlds",
    "particles",
    "propulsion",
    "psionics",
    "statecraft",
    "voidcraft"
  ],
  "edges": [
    {
      "appliesToEmpireTypes": {},
      "backward": false,
      "bandSpan": -4,
      "from": "giga_tech_amb_supertensiles",
      "groupId": null,
      "kind": "prerequisite",
      "to": "giga_tech_amb_living_metal_infusion"
    },
    {
      "appliesToEmpireTypes": {},
      "backward": false,
      "bandSpan": 0,
      "from": "tech_mine_living_metal",
      "groupId": null,
      "kind": "prerequisite",
      "to": "giga_tech_amb_living_metal_infusion"
    },
    {
      "appliesToEmpireTypes": {
        "nomadic": [
          "yes"
        ]
      },
      "backward": false,
      "bandSpan": 0,
      "from": "tech_mega_engineering",
      "groupId": null,
      "kind": "potential-gate",
      "to": "giga_tech_arkship_neutronium_harvester"
    },
    {
      "appliesToEmpireTypes": {},
      "backward": false,
      "bandSpan": 0,
      "from": "tech_mega_engineering",
      "groupId": null,
      "kind": "prerequisite",
      "to": "giga_tech_arkship_neutronium_harvester"
    },
    {
      "appliesToEmpireTypes": {},
      "backward": false,
      "bandSpan": 0,
      "from": "tech_battleships",
      "groupId": "giga_tech_asteroid_artillery#alt0",
      "kind": "alternative",
      "to": "giga_tech_asteroid_artillery"
    },
    {
      "appliesToEmpireTypes": {},
      "backward": false,
      "bandSpan": 0,
      "from": "tech_stingers",
      "groupId": "giga_tech_asteroid_artillery#alt0",
      "kind": "alternative",
      "to": "giga_tech_asteroid_artillery"
    },
    {
      "appliesToEmpireTypes": {},
      "backward": true,
      "bandSpan": 1,
      "from": "tech_mega_engineering",
      "groupId": null,
      "kind": "prerequisite",
      "to": "giga_tech_asteroid_artillery_health_upgrade"
    },
    {
      "appliesToEmpireTypes": {},
      "backward": false,
      "bandSpan": -5,
      "from": "giga_tech_blokkat_armor_study",
      "groupId": null,
      "kind": "prerequisite",
      "to": "giga_tech_blokkat_engineering_repeatable"
    },
    {
      "appliesToEmpireTypes": {},
      "backward": true,
      "bandSpan": 1,
      "from": "tech_mega_engineering",
      "groupId": null,
      "kind": "prerequisite",
      "to": "giga_tech_disco_moon"
    },
    {
      "appliesToEmpireTypes": {},
      "backward": true,
      "bandSpan": 1,
      "from": "tech_mega_engineering",
      "groupId": null,
      "kind": "prerequisite",
      "to": "giga_tech_equatorial_shipyard"
    },
    {
      "appliesToEmpireTypes": {},
      "backward": true,
      "bandSpan": 1,
      "from": "tech_gateway_construction",
      "groupId": null,
      "kind": "prerequisite",
      "to": "giga_tech_interstellar_habitat"
    },
    {
      "appliesToEmpireTypes": {},
      "backward": false,
      "bandSpan": -1,
      "from": "tech_habitat_1",
      "groupId": null,
      "kind": "prerequisite",
      "to": "giga_tech_interstellar_habitat"
    },
    {
      "appliesToEmpireTypes": {},
      "backward": true,
      "bandSpan": 1,
      "from": "tech_mega_engineering",
      "groupId": null,
      "kind": "prerequisite",
      "to": "giga_tech_interstellar_habitat"
    },
    {
      "appliesToEmpireTypes": {},
      "backward": false,
      "bandSpan": 0,
      "from": "giga_tech_maginot_world",